{
  "name": "cross_domain_precedent_poc",
  "version": "0.3.0",
  "source_policy": "국가법령정보센터에 공개된 대법원 판시사항·판결요지만 사용하고, 본문을 임의 생성하지 않는다.",
  "precedents": [
    {
      "precedent_id": "supreme-court-2016do13263",
      "evidence_type": "precedent",
      "court": "대법원",
      "case_number": "2016도13263",
      "decision_date": "2017-04-07",
      "case_name": "개인정보보호법위반·정보통신망이용촉진및정보보호등에관한법률위반(개인정보누설등)",
      "issues": [
        "개인정보의 제3자 제공과 처리위탁을 구별하는 기준",
        "처리위탁의 수탁자가 개인정보 보호법 제17조의 제3자에 해당하는지 여부",
        "거짓이나 그 밖의 부정한 수단으로 개인정보 처리 동의를 받았는지 판단하는 방법"
      ],
      "holding_summary": "대법원은 제3자 제공은 본래의 수집·이용 목적을 넘어 제공받는 자의 업무와 이익을 위해 개인정보가 이전되는 경우이고, 처리위탁은 본래 목적과 관련된 위탁자 자신의 업무와 이익을 위해 이전되는 경우라고 구별하였다. 위탁 범위 안에서 위탁자의 관리·감독을 받으며 독자적 이익이 없는 수탁자는 제17조의 제3자에 해당하지 않는다고 보았다.",
      "reasoning_summary": "제공인지 위탁인지는 명칭만으로 정하지 않고 개인정보 취득 목적과 방법, 대가, 실질적 관리·감독, 정보주체 보호에 미치는 영향, 개인정보를 실질적으로 이용할 필요가 있는 자 등을 종합하여 판단한다. 부정한 방법에 의한 동의 여부도 동의서 형식만 분리해 보지 않고 수집 동기·목적·방법·정보 규모와 관련 법령 준수 등 전체 과정을 고려한다.",
      "related_statutes": [
        {"law_id": "011357", "law_name": "개인정보 보호법", "article_no": "제17조", "role": "제3자 제공의 규범 근거"},
        {"law_id": "011357", "law_name": "개인정보 보호법", "article_no": "제26조", "role": "처리위탁의 규범 근거"},
        {"law_id": "011357", "law_name": "개인정보 보호법", "article_no": "제22조", "role": "동의를 받는 방법에 관한 보조 근거"}
      ],
      "source_url": "https://www.law.go.kr/LSW/precInfoP.do?precSeq=184700",
      "source_section": "판시사항 및 판결요지",
      "context_date": "2017-04-07",
      "legal_context_note": "판결은 당시 개인정보 보호법과 당시 정보통신망법을 함께 해석하였다. 현재 적용 시에는 현행 조문과 개정 경과를 별도로 확인해야 한다.",
      "source_checked_at": "2026-07-31"
    },
    {
      "precedent_id": "supreme-court-2014da235080",
      "evidence_type": "precedent",
      "court": "대법원",
      "case_number": "2014다235080",
      "decision_date": "2016-08-17",
      "case_name": "부당이득금반환(공개된 개인정보를 수집하여 제3자에게 제공한 행위에 대하여 개인정보자기결정권의 침해를 이유로 위자료를 구하는 사건)",
      "issues": [
        "이미 공개된 개인정보도 개인정보자기결정권의 보호대상인지 여부",
        "공개된 개인정보를 별도 동의 없이 영리 목적으로 처리한 행위의 위법성 판단 기준",
        "객관적으로 공개 동의 범위 안의 처리에 별도 동의가 필요한지 여부"
      ],
      "holding_summary": "대법원은 이미 공개되었거나 공적 생활에서 형성된 정보도 개인정보자기결정권의 보호대상이라고 보았다. 다만 정보주체가 공개한 개인정보를 객관적으로 인정되는 공개 동의 범위 안에서 처리하는 경우에는 별도 동의가 필요하지 않고, 별도 동의가 없다는 이유만으로 개인정보 보호법 제15조나 제17조 위반이라고 볼 수 없다고 판단하였다.",
      "reasoning_summary": "공개 동의 범위는 개인정보의 성격, 공개 형태와 대상, 정보주체의 공개 의도와 목적, 후속 처리 형태, 공개 대상 범위의 변화, 원래 공개 목적과의 관련성을 종합해 객관적으로 판단한다. 영리 목적이 있다는 사정만으로 곧바로 위법한 것은 아니며, 정보주체의 인격적 이익과 알 권리·표현의 자유·영업의 자유 등 충돌하는 이익을 구체적으로 비교한다.",
      "related_statutes": [
        {"law_id": "011357", "law_name": "개인정보 보호법", "article_no": "제15조", "role": "수집·이용의 규범 근거"},
        {"law_id": "011357", "law_name": "개인정보 보호법", "article_no": "제17조", "role": "제3자 제공의 규범 근거"},
        {"law_id": "011357", "law_name": "개인정보 보호법", "article_no": "제20조", "role": "정보주체 이외로부터 수집한 경우의 통지에 관한 보조 근거"},
        {"law_id": "011357", "law_name": "개인정보 보호법", "article_no": "제37조", "role": "처리정지 등 사후통제에 관한 보조 근거"}
      ],
      "source_url": "https://www.law.go.kr/LSW/precInfoP.do?precSeq=183259",
      "source_section": "판시사항 및 판결요지",
      "context_date": "2016-08-17",
      "legal_context_note": "판결의 법리는 공개 당시의 객관적 동의 범위에 관한 것으로, 공개된 개인정보를 언제나 자유롭게 처리할 수 있다는 의미가 아니다. 현재 적용 시에는 현행법과 구체적 처리 맥락을 별도로 확인해야 한다.",
      "source_checked_at": "2026-07-31"
    },
    {
      "precedent_id": "supreme-court-2020da247190",
      "evidence_type": "precedent",
      "court": "대법원",
      "case_number": "2020다247190",
      "decision_date": "2024-12-19",
      "case_name": "임금",
      "issues": [
        "고정성이 통상임금의 개념적 징표인지 여부",
        "재직조건·근무일수조건·성과급의 통상임금 판단 기준",
        "변경된 통상임금 법리의 적용 시점"
      ],
      "holding_summary": "대법원 전원합의체는 고정성을 통상임금의 개념적 징표에서 제외하고, 소정근로의 대가로 정기적·일률적으로 지급하기로 정한 임금인지를 중심으로 판단하도록 법리를 변경하였다. 재직조건이나 소정근로일수 이내의 근무일수 조건만으로 통상임금성이 부정되지는 않지만, 근무실적에 따른 순수 성과급은 원칙적으로 소정근로 대가성이 부족하고 실적과 무관한 최소보장액은 달리 볼 수 있다고 하였다.",
      "reasoning_summary": "통상임금은 법령 부합성, 강행성, 소정근로 가치 반영성, 사전적 산정 가능성 및 연장근로 억제라는 정책 목적에 맞게 해석해야 한다. 변경 법리는 원칙적으로 2024년 12월 19일 이후 통상임금 산정에 적용하되, 당해 사건과 선고 당시 관련 쟁점이 계속 중인 병행사건에는 예외적으로 적용한다.",
      "related_statutes": [
        {"law_id": "001872", "law_name": "근로기준법", "article_no": "제2조", "role": "임금과 평균임금 정의에 관한 규범 근거"},
        {"law_id": "001872", "law_name": "근로기준법", "article_no": "제56조", "role": "연장·야간·휴일근로 가산임금의 규범 근거"}
      ],
      "source_url": "https://www.law.go.kr/LSW/precInfoP.do?precSeq=600537",
      "source_section": "판시사항 및 판결요지",
      "context_date": "2024-12-19",
      "legal_context_note": "통상임금 법리를 변경한 전원합의체 판결이다. 적용 시점이 명시되어 있으므로 2024년 12월 18일까지의 근로와 당해·병행사건 여부를 구분해야 한다.",
      "source_checked_at": "2026-07-31"
    },
    {
      "precedent_id": "supreme-court-2013da69989-69996",
      "evidence_type": "precedent",
      "court": "대법원",
      "case_number": "2013다69989,69996",
      "decision_date": "2015-05-14",
      "case_name": "손해배상등·미수금",
      "issues": [
        "구 전자금융거래법 제9조의 사고 의미",
        "이용자의 거래지시대로 의도한 거래가 실행된 경우 사고 해당 여부",
        "시스템 오류가 존재한다는 사정만으로 손해배상책임이 성립하는지 여부"
      ],
      "holding_summary": "대법원은 구 전자금융거래법 제9조의 사고를 권한 없는 제3자에 의한 거래, 이용자의 거래지시가 없는 거래 또는 거래지시와 이행 결과가 불일치한 경우 등으로 보았다. 이용자가 직접 거래지시를 하였고 본래 의도한 대로 거래가 실행되었다면 시스템 오류가 있었더라도 특별한 사정이 없는 한 같은 조의 사고에 해당하지 않는다고 판단하였다.",
      "reasoning_summary": "전자금융거래가 비대면·자동화 방식으로 이루어진다는 특성을 고려해 권한 없는 거래와 지시·결과 불일치로 인한 손해로부터 이용자를 보호하는 조문의 취지를 중심으로 사고의 범위를 해석하였다.",
      "related_statutes": [
        {"law_id": "010199", "law_name": "전자금융거래법", "article_no": "제2조", "role": "전자금융거래와 오류의 정의에 관한 보조 근거"},
        {"law_id": "010199", "law_name": "전자금융거래법", "article_no": "제8조", "role": "오류 정정 요구에 관한 보조 근거"},
        {"law_id": "010199", "law_name": "전자금융거래법", "article_no": "제9조", "role": "전자금융사고 손해배상책임의 규범 근거"}
      ],
      "source_url": "https://www.law.go.kr/LSW/precInfoP.do?precSeq=178075",
      "source_section": "판시사항 및 판결요지",
      "context_date": "2015-05-14",
      "legal_context_note": "2013년 5월 22일 법률 제11814호로 개정되기 전 전자금융거래법 제9조에 관한 판결이다. 현행 사건에 적용할 때에는 현행 조문과 사고 유형을 별도로 확인해야 한다.",
      "source_checked_at": "2026-07-31"
    },
    {
      "precedent_id": "supreme-court-2013da14880-14897",
      "evidence_type": "precedent",
      "court": "대법원",
      "case_number": "2013다14880,14897",
      "decision_date": "2013-06-27",
      "case_name": "손해배상(기)등·위약금",
      "issues": [
        "적법한 이행최고 후 불이행만으로 해제권을 행사할 수 있는지 여부",
        "최고기간 안에 이행하지 못한 정당한 사유와 신의칙의 관계"
      ],
      "holding_summary": "대법원은 이행최고가 적법하더라도 채무자가 최고기간 또는 상당한 기간 안에 이행하지 못한 데 정당한 사유가 있다고 인정되면 신의칙상 해제권 행사가 제한될 수 있다고 하였다.",
      "reasoning_summary": "정당한 사유와 해제권 제한 여부는 이행지체의 전후 사정, 이행에 관한 당사자의 태도, 소송 경과 등 제반 사정을 종합하여 판단한다. 따라서 최고와 기간 경과라는 형식적 요건만으로 해제의 효력을 단정해서는 안 된다.",
      "related_statutes": [
        {"law_id": "001706", "law_name": "민법", "article_no": "제2조", "role": "신의성실 원칙의 보조 근거"},
        {"law_id": "001706", "law_name": "민법", "article_no": "제544조", "role": "이행지체와 해제의 규범 근거"}
      ],
      "source_url": "https://www.law.go.kr/LSW/precInfoP.do?precSeq=170166",
      "source_section": "판시사항 및 판결요지",
      "context_date": "2013-06-27",
      "legal_context_note": "민법 제544조의 해제 요건을 신의칙과 함께 해석한 판결이다. 구체적 정당한 사유는 사실관계와 당사자 태도를 확인하여 판단해야 한다.",
      "source_checked_at": "2026-07-31"
    },
    {
      "precedent_id": "supreme-court-2021da264673",
      "evidence_type": "precedent",
      "court": "대법원",
      "case_number": "2021다264673",
      "decision_date": "2021-12-30",
      "case_name": "약정금",
      "issues": [
        "민법 제536조 제2항의 상대방 이행이 곤란할 현저한 사유의 의미",
        "불안의 항변권 인정 여부의 판단 방법",
        "계약 당시 예상한 불확실성이 선이행 거절 사유가 되는지 여부"
      ],
      "holding_summary": "대법원은 상대방의 이행이 곤란할 현저한 사유란 반대급부를 받지 못할 위험 때문에 선이행을 강제하는 것이 공평과 신의칙에 반하는 경우를 뜻하고, 양 당사자의 사정을 종합하여 판단해야 한다고 하였다. 해당 사유가 반드시 계약 후 새로 발생한 사정에만 한정되지는 않지만 계약 당시의 의사에 부합하게 판단해야 한다.",
      "reasoning_summary": "계약에서 예정한 불확실성과 위험 배분, 선이행 약정의 내용, 사후 확인 행위 등을 함께 보아야 한다. 당사자가 계약 당시 예상한 재개발 지연만으로 선이행의무를 거절하게 하면 명시적 반환 약정이 무의미해지므로 이 사건에서는 불안의 항변권을 인정하지 않았다.",
      "related_statutes": [
        {"law_id": "001706", "law_name": "민법", "article_no": "제536조", "role": "동시이행의 항변권과 불안의 항변권의 규범 근거"}
      ],
      "source_url": "https://www.law.go.kr/LSW/precInfoP.do?precSeq=231523",
      "source_section": "판시사항 및 판결요지",
      "context_date": "2021-12-30",
      "legal_context_note": "불안의 항변권은 단순한 불확실성이 아니라 계약상 위험 배분과 공평·신의칙을 포함한 구체적 사정을 종합하여 판단한다.",
      "source_checked_at": "2026-07-31"
    },
    {
      "precedent_id": "supreme-court-2023do3673",
      "evidence_type": "precedent",
      "court": "대법원",
      "case_number": "2023도3673",
      "decision_date": "2025-07-18",
      "case_name": "개인정보보호법위반[가처분 사건의 채무자가 법원에 입주민들의 개인정보가 기재된 입주자카드를 제출한 사건]",
      "issues": [
        "재판·수사절차에서 개인정보가 포함된 자료를 제출한 행위의 위법성 조각 가능성",
        "개인정보 제출이 사회상규에 위배되지 않는 정당행위인지 판단하는 기준"
      ],
      "holding_summary": "대법원은 소송상 필요한 주장의 증명이나 방어권 행사 등을 위해 개인정보가 포함된 자료를 법원 또는 수사기관에 제출한 경우 사회상규에 위배되지 않는 행위로서 위법성이 조각될 수 있다고 하였다. 다만 재판에 제출했다는 이유만으로 언제나 허용되는 것은 아니다.",
      "reasoning_summary": "정당행위 여부는 자료의 수집·보유·제출 경위와 목적, 제출 상대방, 목적 달성에 필요한 최소한의 정보인지, 비실명화 등 안전조치 가능성과 실시 여부, 정보의 민감성·양과 침해 정도, 다른 제출 수단의 존재 및 불가피성을 종합하여 객관적·합리적으로 판단한다.",
      "related_statutes": [
        {"law_id": "011357", "law_name": "개인정보 보호법", "article_no": "제17조", "role": "개인정보 제3자 제공의 규범 근거"},
        {"law_id": "011357", "law_name": "개인정보 보호법", "article_no": "제18조", "role": "목적 외 이용·제공 제한과 예외의 규범 근거"},
        {"law_id": "011357", "law_name": "개인정보 보호법", "article_no": "제59조", "role": "개인정보 누설·권한 없는 제공 금지의 규범 근거"}
      ],
      "source_url": "https://www.law.go.kr/LSW/precInfoP.do?precSeq=607821",
      "source_section": "판시사항 및 판결요지",
      "context_date": "2025-07-18",
      "legal_context_note": "판결은 2020년 8월 5일 시행 개정 전 개인정보 보호법을 해석하였다. 현행 사건에서는 현행 제17조·제18조·제59조와 형법상 정당행위 요건을 함께 확인해야 한다.",
      "source_checked_at": "2026-07-31"
    },
    {
      "precedent_id": "supreme-court-2009da51417",
      "evidence_type": "precedent",
      "court": "대법원",